<?xml version="1.0" encoding="utf-8"?>
<!DOCTYPE resources SYSTEM "../map.dtd" []>
<resources>
 
 <author>
   <name>Christopher L. Stanley</name>
   <nickname>NinjaNumberNine</nickname>
   <email>niftyninjanumbernine@gmail.com</email>
   <country>America</country>
 </author>
 
 <add_pad>1</add_pad> 
 <point name="upper_left_pad" x="500" y="500" /> 
 <point name="lower_right_pad" x="500" y="0" /> 
 
 <surface name="sky" file="bg.jpg" />
 <surface name="map" file="fg.png" />
 <surface name="preview" file="pr.jpg" />
 
 <name>Qubos Castle</name>
  <water>water</water>
 <nb_mine>6</nb_mine>
 <is_open>1</is_open>
 
 <sprite name="wind_particle">
   <image file="qubos_anim.png">
     <grid pos="0,0" size="120,120" array="24,1"/>
   </image>
 </sprite>
 
 <wind>
   <nbr_sprite>5</nbr_sprite>
   <need_flip>0</need_flip>
   <rotation_speed>0</rotation_speed>
   <mass>2.0</mass>
   <wind_factor>6.5</wind_factor>
   <air_resist_factor>0.1</air_resist_factor>
   <gravity_factor>0.1</gravity_factor>
   <rebounding>true</rebounding>
   <rebound_factor>3.3</rebound_factor>
 </wind>
 
 <music_playlist>funfair</music_playlist>
 
</resources>
