<?xml version="1.0" encoding="UTF-8"?>
<!DOCTYPE resources SYSTEM "../map.dtd" []>
<resources>
  <author>
    <nickname>psik0</nickname>
    <email>dbernalm AT gmail.com</email>
    <country>Spain</country>
  </author>

  <surface name="sky" file="bg.jpg" />
  <surface name="map" file="puyolandia.png" />
  <surface name="preview" file="preview.jpg" />

  <name>Puyoland</name>
  <water>water</water>
  <nb_mine>10</nb_mine>
  <is_open>1</is_open>
  <!-- pad is given in pixel count. -->
  <add_pad>1</add_pad>
  <point name="upper_left_pad" x="1100" y="700" />
  <point name="lower_right_pad" x="1100" y="0" />

  <music_playlist>sea</music_playlist>
</resources>
