<?xml version="1.0" encoding="utf-8"?>
<!DOCTYPE resources SYSTEM "../map.dtd" []>
<resources>
	<author>
		<name>kiriep</name>
		<nickname>kiriep</nickname>
		<email>kiriep@gmail.com</email>
		<country>France</country>
	</author>

	<surface name="sky" file="sky.jpg" />
	<surface name="map" file="background.png" />
	<surface name="preview" file="preview.jpg" />


	<name>Factory</name>
	<water>no</water>
	<nb_barrel>10</nb_barrel>
	<nb_mine>5</nb_mine>
	<is_open>0</is_open>

  <sprite name="wind_particle">
    <image file="etincelle.png">
      <grid pos="0,0" size="5,5" array="1,1"/>
    </image>
  </sprite>
 
  <wind>
    <nbr_sprite>500</nbr_sprite>
    <need_flip>1</need_flip>
    <mass>0.1</mass>
    <wind_factor>8.0</wind_factor>
    <air_resist_factor>0.1</air_resist_factor>
    <gravity_factor>0.5</gravity_factor>
    <rebounding>true</rebounding>
    <rebound_factor>1.5</rebound_factor>
  </wind>
</resources>
