<?xml version="1.0" encoding="UTF-8"?>
<!DOCTYPE resources SYSTEM "../map.dtd" []>
<resources>
	<author>
		<name>Olivier Boyer</name>
		<nickname>ziolive</nickname>
		<email>ziolive AT gmail.com</email>
		<country>France</country>
	</author>

	<surface name="sky" file="sky2.jpg" />
	<surface name="map" file="background.png" />
	<surface name="preview" file="preview.jpg" />

	<name>Vulcano</name>
	<water>lava</water>
	<nb_mine>7</nb_mine>
	<is_open>0</is_open>
</resources>
