<?xml version="1.0" encoding="utf-8"?>
<!DOCTYPE resources SYSTEM "../map.dtd" []>
<resources>
 
 <author>
   <name>Zelinskiy Ivan</name>
   <nickname>ivze</nickname>
   <email>ivze AT bk DOT ru</email>
   <country>Russia</country>
 </author>
 
 <surface name="sky" file="sky.jpg" />
 <surface name="map" file="ship.png" />
 <surface name="preview" file="preview.jpg" />
 
 <name>Sea Ship</name>
 <water>water</water>
 <nb_mine>8</nb_mine>
 <is_open>1</is_open>


   <sprite name="wind_particle">
    <image file="wp.png">
      <grid pos="0,0" size="141,134" array="1,1"/>
    </image>
  </sprite>
 
  <wind>
    <nbr_sprite>15</nbr_sprite>
    <need_flip>1</need_flip>
    <mass>1.0</mass>
    <wind_factor>4.0</wind_factor>
    <air_resist_factor>0.4</air_resist_factor>
    <gravity_factor>0</gravity_factor>
    <rebounding>true</rebounding>
    <rebound_factor>1.5</rebound_factor>
  </wind>
  
 
 
</resources>
