<?xml version="1.0" encoding="UTF-8"?>
<!DOCTYPE resources SYSTEM "../map.dtd" []>
<resources>
	<author>
		<name>jacob</name>
		<nickname>meatlover</nickname>
		<email>jb.meatlover@gmail.com</email>
		<country>USA</country>
	</author>

	<surface name="sky" file="bg.jpg" />
	<surface name="map" file="map.png" />
	<surface name="preview" file="prev.jpg" />


	<name>Glass Pyramids</name>
	<water>water</water>
	<nb_mine>3</nb_mine>
	<nb_barrel>2</nb_barrel>
	<is_open>1</is_open>

	<music_playlist>sea</music_playlist>
</resources>
