<?xml version="1.0" encoding="UTF-8"?>
<!DOCTYPE resources SYSTEM "../map.dtd" []>
<resources>
	<author>
		<name>Olivier Boyer</name>
		<nickname>ziolive</nickname>
		<email>ziolive AT gmail.com</email>
		<country>France</country>
	</author>

	<surface name="sky" file="decor_paradis_bg.jpg" />
	<surface name="map" file="decor_paradis.png" />
	<surface name="preview" file="paradis_preview.jpg" />


	<name>Paradis</name>
	<water>no</water>
	<nb_mine>7</nb_mine>
	<is_open>1</is_open>
	<!-- pad is given in pixel count. -->
	<add_pad>1</add_pad>
	<point name="upper_left_pad" x="0" y="2000" />
	<point name="lower_right_pad" x="0" y="1000" />

	<music_playlist>sea</music_playlist>
</resources>
