<?xml version="1.0" encoding="utf-8"?>
<!DOCTYPE resources SYSTEM "../map.dtd" []>
<resources>
	<author>
		<name>kiriep</name>
		<nickname>kiriep</nickname>
		<email>kiriep@gmail.com</email>
		<country>France</country>
	</author>

	<surface name="sky" file="sky.jpg" />
	<surface name="map" file="background.png" />
	<surface name="preview" file="preview.jpg" />


	<name>Futura</name>
	<water>water</water>
	<nb_barrel>5</nb_barrel>
	<nb_mine>10</nb_mine>
	<is_open>1</is_open>

	
</resources>
